line_number,speaker,timestamp,text,interviewee,is_interviewee,is_interviewer,role
7,Queena,,"Um, one of them, I would say, I actually… oh yeah, before I paid the subscription for… for the Canva, I would… I would go to about it this way. I would use my iPad to draw it myself. Like, I would reference the template that Canva has. Template is such a strong asset in Canva. Because of how professional it looks for some of them. And then I would just draw it, like, using the same shape, same color, and then I would draw it onto, like, um… That's like, what is it called? Let me see. I think Procreate. That's… that's what it's. Um, I feel like… Procreate is so nice if you want to, like, hand draw stuff, it's really nice. And also, yeah, I use Canva for thumbnail making for YouTube videos. And sometimes I want to add those, like, hand-drawn details to make it look a bit more, you know, handmade, personal. Um, I have to use, like, um… the cursor to draw it, and it's slightly, like… it's not… it's not as customizable, like, the pen options aren't that many. And it's, like, all limited to probably, like, 3 options, and they have, like, very specific functions, like, for example, they… I don't know if you know the, um, streamline function, but they would, like, When you draw, you don't have, like, the full control over it. They would, like, kind of curve you back to where your previous like drawing is, so it's kind of like that. Um, I wish they have, um, I don't know, I haven't used it on iPad, but if they have an option to, like, draw stuff nicely on Canva, that would be nice. It doesn't have to be, like, very elaborate. It could be just, like, Um, just, it could be just, like, good notes. Like, we're… we're the pen functions or something is slightly more customizable, but not to the extent of park rate. But it then would be enough for me like, handwrite stuff, because, like, I feel like I'm able to draw, like, tiny little stars or tiny little outlines, but then it wouldn't be enough for me to write, like… happy, or something, like, without making them look very… like, obvious that I'm writing it with my trackpad.",Queena,True,False,interviewee
8,Frank,,"Okay. Yeah, that makes sense.",Queena,False,True,interviewer
9,Queena,,"And also, it's slightly limited in terms of, like, the pen functions, like, you can't change how it's tapered, like, towards the end, I think it's just, like, if you let go, then it's like a sharp ending instead of, like, around edges, which I know this is, like, so, like, minute, but, like, sometimes those stuff just… matters.",Queena,True,False,interviewee
10,Frank,,"Got it. Do you think going to a professional setting when you're in college or looking for SARPs or whatever, and when you go to a professional setting once you graduate college, when you land a real job. Do you think he'll keep using Canva?",Queena,False,True,interviewer
11,Queena,,"Okay, the thing about that is it's actually very dependent on the workspace, so I think it, like, from the perspective that I look at now, when I think about it, It would also be like, oh, it's my personal choice, and I can choose between the different workspace, but when… in the actual company, they would give you instructions to, like, use Figma, or use Photoshop, or use Canva. And that's also because of the fact, if they have subscription for it, and then people can, whether they can collaborate on it. So, I feel like, in terms of the industry, if… If the company itself is reluctant in changing, or, like, using that as a team, then you wouldn't be using it. So it's less of a matter of personal choice, but more of, like, if the company operates on it or not. And for… for… as for my experience so far in working at startup, they're very flexible. And if you want to use Canva Pro, they would give you Canva Pro, like, they would give you a budget, and you can… they can work within that. Um, but… for a more, like, I don't know, for more… bigger company or more established one, I think if they already have a system in place, It'd be hard to convince them to switch, unless for a compelling reason.",Queena,True,False,interviewee
12,Frank,,Okay.,Queena,False,True,interviewer
13,Queena,,And they usually wouldn't require you to work within the workspace. For purposes of collaborating and also consistency.,Queena,True,False,interviewee
14,Frank,,"Mm-hmm. So, for the current university level of professionalism, Would you keep using Canva coming from high school curriculars to uni clubs?",Queena,False,True,interviewer
15,Queena,,"Okay, that's interesting. Because the clubs that I'm in right now, it's more… okay, I'm in the Trojan news, which I'm part of the video editing team. For video editing, I won't be using Canva, just because of how limiting it is. And I'll be using… Uh, like, I think even iMovie would be better, honestly. Um, so I would be using Final Cut, as usual. And then for… Marketing purposes, um… I'm think… we haven't started actual marketing yet, because we've been doing branding for the past 2 months, but moving into that, I think I might be for posts, because of the fact that it's still very nice for… quick and easy, um… layouts. Um, I think Figma, for me, for that, is just way too unnecessarily complicated.",Queena,True,False,interviewee
16,Frank,,Right. Yeah.,Queena,False,True,interviewer
17,Queena,,"And I think Canva just has better layouts and better templates. So I think for that, I would. Um… But other… otherwise… and for YouTube thumbnails, I still would be using Canva, just because of just how ease of use it is for background removing. That itself, like, it's solely, like… That kind of movie, like, that one feature sold me, because of just how incredibly good it is, but yeah. Um… Yeah. For other ones? Nope, I don't know.",Queena,True,False,interviewee
18,Frank,,Okay. What would you say your design service using percentage transitioning from highschool to university was like?,Queena,False,True,interviewer
19,Queena,,"Okay, I think… Canva definitely peaked for me in probably grade 11. Just because there were so many events, banners we have to make, and the fact that we had to make them in rapid successions, and, like, it's one after… So, Canva was so nice for us to make sure that, um, the kind of theme was on point, because we could just, like, you know, copy and paste it over into another template, and then maintain the font, maintain the color scheme, And we can transition from the PowerPoint to making a banner. So that's, like, the really nice option of that, and… Um, afterwards, I haven't been using it as much because I've been also… For us to, like, use Figma, for example, or to use other softwares, so it's, like, slightly declining. It used to be, like, 100% Canva. And then now it's slowly transitioning into, like, also having to learn other softwares.",Queena,True,False,interviewee
20,Frank,,"Okay, got it.",Queena,False,True,interviewer
21,Queena,,"Probably still, like, 60% Canva, because of just how… how… how, like, how much I've been using it in the past, and most of my past works has been on it.",Queena,True,False,interviewee
22,Queena,,"Oh yeah, and also one thing that's very confusing is you know how there's, like, workspace within Canva? And I can't transition it from one workspace to another. For example, if I've been using Mr. Kwong's workspace, and I've been having Hemet stuff in there, which is my company.",Queena,True,False,interviewee
23,Frank,,Mm-hmm.,Queena,False,True,interviewer
24,Queena,,"I've been using it there, um, and we have… now have a Hemo workspace. I can't really transition it into that. Like, or I don't know how to in an easy way. That's what's quite frustrating.",Queena,True,False,interviewee
25,Frank,,"Okay, I totally agree, that was one of the things that was frustrating for me as well transitioning to a Yale email account. Has that been a big issue for you?",Queena,False,True,interviewer
26,Queena,,"Yeah, it really has… I’ve been using my old LMS account for Canva for so long, and since its non-existent now, there’s almost 100 files on a non-existent account right now. And I don't want to lose them all, but, like, I have, like, no way to deal with it.",Queena,True,False,interviewee
27,Frank,,"Hmm. Okay, cool. Wait, so have you tried transitioning from one email account to another?",Queena,False,True,interviewer
28,Queena,,"I have, but I don't think it ever worked. I'm not sure why. I think I tried, like, probably 2 or 3 times by now, but… The last time I tried, I think it just made me, like, give up. So this is not happening.",Queena,True,False,interviewee
29,Frank,,"Ok, thank you so much for your time. That was a very long time. Um, I'll end the recording now, so this will be the end of our formal interview.",Queena,False,True,interviewer
1,Navaa,,"So if you can just tell us a bit about yourself, name, age, what you do, what like your hobbies are, how you use Canva, sure.",Jane,False,True,interviewer
2,Jane,,"Hi, my name is Jane. I'm a senior at UCLA, studying polysign econ in my free time, I like to do yoga. Shop go, you know, look at different cafes in LA with my friends, hang out with friends, watch movies.",Jane,True,False,interviewee
3,Navaa,,"So would you describe yourself as, like, a current user of Canva to like, in in this moment as a student?",Jane,False,True,interviewer
4,Jane,,"We do use Canva, we do have our premium accounts. I cannot access it, to be honest. We use all the time for group projects, like earlier today, I was doing a group project for one of my classes, and we used Canva for slideshows. I think we've had Canva premium, like, accessible to students for either two or three years. Now, I know it wasn't a thing my freshman year, but definitely my sophomore or junior year. Like, everyone used to  access Canva Pro, um, yeah, I think it's pretty good. Like, I use it quite a bit, but I think some people actually defer to Google Slides.",Jane,True,False,interviewee
5,Navaa,,"Yeah, that is kind of like a nice segue into the next question, which is, like, what's the biggest value that you would say Canva provides for you currently? And like, why do you use it? Why would you choose Canva for like, something specifically over like, Google Slides?",Jane,False,True,interviewer
6,Jane,,"Personally, I wouldn't choose it over Google Slides. I just think I know how to use Google, like the Google Cloud stuff, better than I know how to use other, secondary party stuff like Canva. But I guess if I were to use it, it would for it to be for, if I want to make an Instagram post for a club or something, or if I want to make a flyer for a club, or even if I want to do like a presentation or something, I think Canva offers a lot more like templates and stickers and to think make things more eye catching. I think that's why a lot of people like to use it.",Jane,True,False,interviewee
7,Navaa,,"Yeah, absolutely like aesthetic value. Yeah, yeah. And then what are some reasons that you would like stop using Canva and have you switched to another design tool before? And if yes, which one and why it's just like stuff you don't like about it?",Jane,False,True,interviewer
8,Jane,,"Actually, today, I was having a hard time trying to add a text box to Canva. So I think that's kind of confusing. I think like, you can add a text box, then if you click out of it, it clicks away, or something, it's kind of hard to find. I think, honestly, that's it. Like, I think it's pretty intuitive. Honestly, I think it's very similar to Google, Google Slides or Outlook slides or whatever they're called, but just the organization of everything. But I think besides Canva, I haven't really used other stuff, like for UCLA. I've used Adobe Acrobat while I was at work over the summer. I would use it because my firm had it, so I would use it and have my Canva Pro.",Jane,True,False,interviewee
9,Navaa,,"Um, and I guess this next question is, is very similar to the last one I just asked. But what do you find are your current pain points when using Canva? If there isn't anything, you don't have to answer it.",Jane,False,True,interviewer
10,Jane,,"Um, I think the pain points, I don't really have one, to be honest. I think it's  what I was thinking about the text boxes. But I think that's just like, I don't use Canva as much as other people do. So that's just a skill issue that I personally have.",Jane,True,False,interviewee
11,Navaa,,"I got you, if there's like, any like, like, logistical, like, account stuff as well that you've, like, run into?",Jane,False,True,interviewer
12,Jane,,"Well, I think like for us, you have Canva premium as a UCLA student, I just personally don't know how to access it and that's okay with me, because I don't really find the need to use it. Because it wasn't a thing my freshman year, I've never really switched over from, like, Google Docs or Google slides to Canva. And yeah, I don't really find the need to use Canva premium. So I don't really use it that much. I don't really, like, have a lot of skills or hardships with it, to be honest.",Jane,True,False,interviewee
13,Navaa,,I got you. And then what are some changes or improvements that you think Canva should make to fit your needs specifically better.,Jane,False,True,interviewer
14,Jane,,"I don't know. I honestly feel like Canva is a great, like, tool. It's just I haven't taken my own time to learn more about it. And that’s the main thing that, like, I don't really use Canva because I don't really see a need to most of the time, but I think like that, the fact that a lot of other people use Canva speaks to, you know, how it's grown and everything, and how it seems to be doing pretty well, and, like, suiting a lot of people's needs.",Jane,True,False,interviewee
15,Navaa,,"Yeah. And I guess one last question is, do you know a lot of people that are accessing Canva premium, and are using Canva pro at UCLA specifically? Or is it just that the people you interact with, the people you work with, are also the same, where they don't really feel the need to use it?",Jane,False,True,interviewer
16,Jane,,"I think a lot of people I know use Canva Pro. I think, if it's free at UCLA, then why not use it? I think is the main thing, but it's also, for example, UCLA gives you Microsoft Outlook for free. And I don't know how to use it either, and I think it depends like, how much you actively try to look for it. But I think a lot of people use it, like whoever I was working with on the Micro project today.",Jane,True,False,interviewee
1,Frank,,Do you mind if we disclose your demographic information? Your age and your gender?,Yoyo,False,True,interviewer
2,Yoyo,,"Yeah, sure, that's fine.",Yoyo,True,False,interviewee
3,Frank,,"Okay, great, thank you. Cool. Then, first question is, how long have you been using Canva for?",Yoyo,False,True,interviewer
4,Yoyo,,"Um, I've probably been using Canva for at least, like, 8 years since, like, grade 4.",Yoyo,True,False,interviewee
5,Frank,,"Did you ever have a premium account? Did you pay for them, or did you always… have you always used a free account?",Yoyo,False,True,interviewer
6,Yoyo,,"Um, I never paid for it, I just got a free premium account from my high school, yeah.",Yoyo,True,False,interviewee
7,Frank,,Where did you get this free account from?,Yoyo,False,True,interviewer
8,Yoyo,,"I mean, like, my school kind of provided it, but then, like, Okay, like, they provided it when I was in, like, grade 10 or something, so before that, I just used it for free, like, I never really paid for it.",Yoyo,True,False,interviewee
9,Frank,,"Okay, got it. Do you remember which teacher you got Canva Premium from?",Yoyo,False,True,interviewer
10,Yoyo,,"Um, I think my school just sent me an email, and then they were like, oh, if you're, like, interested in this, you can sign yourself up, but there's, like, limited, like, spots for it, and I just, like, got it, like, immediately.",Yoyo,True,False,interviewee
11,Frank,,"Um, yeah. So, you've always been using Canva for a while. What do you normally use Canva for?",Yoyo,False,True,interviewer
12,Yoyo,,"I guess, I feel like Canva's really useful if you're, like, making, like, low-stakes social media posts, especially for, like, different clubs or, like, For, like, I guess, like, school clubs, too. I don't think it's, like, the best kind of, like, platform for making more advanced design, but if I'm just doing it for, like, I really, really, like, mini project, and I'll probably use Canva.",Yoyo,True,False,interviewee
13,Frank,,"Then, specifically, could you describe how you use Canva? How is Canva used as a part of your workflow when designing posters, websites, flyers?",Yoyo,False,True,interviewer
14,Yoyo,,"Okay, for flyers and, like, for graphic designs in general, like, Canva's good, because, like, especially if you want to make it, like, in a really short time, because they provide you, like, things like templates. Which is, like, quite useful, but if we're talking about, like, website design, like, it's really, really hard to navigate. Like, Figma, I use Figma instead, because, like, Figma is, like, made professionally for, like, making, like, UI design and things like that, so I feel like that would be more useful than Canva.",Yoyo,True,False,interviewee
15,Frank,,"Okay, got it. Could you list all the design services you use?",Yoyo,False,True,interviewer
16,Yoyo,,"All the softwares I use? Okay, um, I use Canva, I use Adobe Illustrator, Adobe Photoshop. Um, I use Figma. And then there's, like, a bunch of, like, um, kind of, like, 3D modeling things I do. Like, I use, um, Fusion 360 Nomad Sculpt. I also use a bit of Blender. Oh, and then there's… there's just things like drawing and editing stuff, like Procreate, and then, like, Final Cut Pro and DaVinci Resolve for, like, videos and stuff. Yeah, that's basically it.",Yoyo,True,False,interviewee
17,Frank,,"Wow. The reason I ask is because I want to know how much of each software do you use, or do you rely on? What would be the percentage distribution of the time you spend usinh these different services?",Yoyo,False,True,interviewer
18,Yoyo,,"It really depends on, like, the purpose, like, for… okay, like, for just, like, basic social media posts and stuff, I'll definitely use Canva, and that's probably, like, Like, 30% of the time, And because I've, like, I do a lot of UI more than a graphic design, I probably use, like, use, like, like, 50% of Figma. And then I feel like the rest… I said 30% for Canvas, so, like, the rest, like, 20%...",Yoyo,True,False,interviewee
19,Yoyo,,"I feel like it's more like Adobe Illustrators and stuff, because, um, like, I also applied to, like, a bunch of, like, clubs, like, for media, like, roles, and they told me that they don't accept Canva. Like, they only use Adobe Illustrators and things like that.",Yoyo,True,False,interviewee
20,Yoyo,,"Yeah, I specifically asked that. Yeah, because I feel like, um, I think it's mainly because, like, Canva, it's like, they provide you so many templates, and it's just, like, really easy for you to just, like, replicate designs that are, like, not that original. So they were like, oh, use Adobe Illustrator because it's, like, more unique, I guess.",Yoyo,True,False,interviewee
21,Frank,,"Oh, okay. Wait, I didn't know that. So, the clubs and universities, the ones you apply to actually specifically said don't use Canva, use Adobe Illustrator?",Yoyo,False,True,interviewer
22,Yoyo,,"Um, I asked them, like, oh, do you guys usually use Canva, or do you accept, like, using Canva for it? And they're like, oh, we still prefer Adobe Illustrator, and we barely use it. So basically, we're not… I was not that allowed to, like, use it, I guess, because it's, like, more, like, illustrator-focused.",Yoyo,True,False,interviewee
23,Frank,,"What do you think you'll be doing in the future, career-wise, and what's your major currently? Do you think you're gonna need to be doing mainly just UI design, graphics design?",Yoyo,False,True,interviewer
24,Frank,,"Do you see yourself using Canva as you progress into more professional settings, like professional clubs and internships, or when you eventually get a job?",Yoyo,False,True,interviewer
25,Yoyo,,"I thought Canva would be, like, useful for me in the long term until, like, I feel like when I contacted that club, and they were like, oh, I don't think we really accept Canva, and then so I was like, okay, maybe, like, um, in a professional setting, they don't really like Canva in general, so I feel like I might be switching to… things like Illustrator, and I guess it's just, like, Figma. more, because I feel like… I don't know, I feel like Canva is something for, like, more, like, casual designers and people who just need to design for, like, And, like, at a beginner's level, so I'm not really sure about that, but I, like… If I had to, like, really answer that question, I don't think I would be using Canva in the long term.",Yoyo,True,False,interviewee
26,Frank,,"Could you describe your use of Canva, how frequently have you used Canva since you started to use it, all the way till now, and also how frequent do you think you’ll use it in the future?",Yoyo,False,True,interviewer
27,Yoyo,,"Okay, um, I definitely use it a lot when I just started, because I wasn't great for it, and I had, like, I had, like, basic, basic knowledge on design, so I felt like it was really useful, because it's super, super easy to, like, navigate, for example, to, like, make shapes and, like, just, like, format them, because it's, like, It's on a… it's on… it's usually used on a website, so it's, like, relatively easy and things like that. Um, and then I feel like when I got to, like, grade 10 or grade 9, I kind of used it, like, extensively. I feel like grade 10, especially because I got, like, the premium account for free, and then that's when I started, like, using it for, like, social media posts and things like that. And I feel like, since I stepped into uni, Um, I use it for, like, my… I think the first social media post I'm doing for, um, a club called Designer Columbia, like, the only club… the design club at Columbia, And then I stopped, and I switched, like, Figma, because, like, I thought it was, like, super hard that I can make it, like, really original.",Yoyo,True,False,interviewee
28,Yoyo,,"So I feel like, in the long term, Um, I might be using less of, like, Canva, maybe? Like, I said 30% in general. I think… I feel like it's gonna drop to, like, 10 or 5. like, maybe next year.",Yoyo,True,False,interviewee
29,Frank,,"So, Canva isn't very suited for what you want to do now, which is more professional work, Is that what I'm hearing?",Yoyo,False,True,interviewer
30,Yoyo,,"Yeah, I don't think Canva is very professional, because, okay, um, for Illustrator, what's really good about Illustrator is that you can, like, adjust, like, vectors, like, super easily, and you can make, like, really, like, original shapes. Like, Canva does offer that, but it's super hard to, like, navigate, especially when you're, like, forming, like, curves and things like that. And also, um, because, like, Illustrator, it's connected to, like, Adobe, and then functions of, like, Photoshop, so you could easily, like, edit images. Especially with, like, just, like, editing images and, like, lighting, and then, like, shades in general, and I feel like with Canva, I feel like there's… Like, they only give you, like, a few filters, and that's it. So it's, like, really hard if I'm, like, switching between different platforms, like, I'd rather just focus, like, on one platform that allows me to do, like, everything I need.",Yoyo,True,False,interviewee
31,Frank,,"Hmm, okay, got it. So, specifically, you mentioned the filters feature. What other features have you found useful in Canva, and what features like that have you found in comparing… when comparing to other apps have not been so good?",Yoyo,False,True,interviewer
32,Yoyo,,"Um, I feel like what's good about Canva, like, like, there's probably… I remember… I think there's this, like, section called, like, Elements and stuff, and you can just, like, search up, like, shapes and icons, and you can just directly paste it in there. If you have the premium account, because most of them are, like, not free, which is, I feel like it's good. I mean, Figma has, like, related things, but it's, like… It's, like, part of, like, a plugin, and you have to, like, you have to, like, find it yourself from, like, an icon, like, library and things like that, and their icons are, like, not as diverse. It's Canvas, so probably, if I need to use, like, Figma, I probably have to, like, draw everything.",Yoyo,True,False,interviewee
33,Yoyo,,"Like, when Canva actually provides me, like, the icons already, so I feel like… That's really good about Canva, and I feel like that's why beginners, like, really like to use it, because it's, like, so easy to, like, just pull and then paste it on your design.",Yoyo,True,False,interviewee
34,Frank,,"In my understanding, at the beginning, you just purely used Canva, and when you got more professional, you started using AI, um, and also Figma and other services like that.",Yoyo,False,True,interviewer
35,Frank,,"So, what was the reason you started to switch from Canva to, like, other services, and when did that happen?",Yoyo,False,True,interviewer
